{
  "schema": "muxui-token-section-page-budget-profile-v1",
  "id": "muxui-token-section-page-budget-2-1-0",
  "queryApiVersion": "2.1.0",
  "lexerVersion": "muxui-lexeme-v1",
  "canonicalEntryOrder": "tokens by Core token ID; source-crosswalk by source ordinal; bytewise ascending UTF-8 for ties",
  "entryCostRule": "Core lexer lexeme count over canonical compact JSON for each complete entry",
  "densePageBudgetTokens": 2048,
  "normalizedWorstCaseEnvelopeSha256": "sha256:ebb291d53b0adc83e9192b5e83e29c725d720cf9e555cac14c907b5a98c42f15",
  "measuredWorstCaseEnvelopeTokens": 201,
  "envelopeReserveTokens": 512,
  "maximumEntryTokens": 1536,
  "defaultItemLimit": 20,
  "maximumItemLimit": 100,
  "minimumProgressEntries": 1,
  "selection": "greatest non-empty canonical-entry prefix within both the item ceiling and remaining token budget",
  "oversizeCode": "MUXUI_QUERY_PAGE_ENTRY_TOO_LARGE",
  "cursorProfile": "muxui-section-cursor-v1",
  "cursorPayloadCanonicalization": "Core canonical JSON UTF-8",
  "cursorEncoding": "c1.<unpadded-base64url-canonical-payload>.<lowercase-sha256-of-canonical-payload>",
  "cursorMaximumBytes": 556,
  "cursorBindings": [
    "queryApiVersion",
    "catalogDigest",
    "tokenSourceContentRevision",
    "section",
    "selectorDigest",
    "nextPosition"
  ],
  "truncation": "forbidden",
  "artifactIdMaximumBytes": 256,
  "artifactIdMaximumLexemes": 125,
  "cursorPositionMaximum": 4294967295,
  "catalogVersionMaximumBytes": 64,
  "catalogVersionMaximumLexemes": 32,
  "envelopeOversizeCode": "MUXUI_QUERY_PAGE_ENVELOPE_TOO_LARGE"
}
